{
  "schema_version": 1,
  "scope": "fusou-grant-delegation-bootstrap-policy-v1",
  "lifecycle": "PROPOSED",
  "operational_enabled": false,
  "publication_authorized": false,
  "issuer": "https://token.actions.githubusercontent.com",
  "jwks_uri": "https://token.actions.githubusercontent.com/.well-known/jwks",
  "issue_audience": null,
  "read_audience": null,
  "repository": "tsukasa-u/FUSOU",
  "repository_id": null,
  "repository_owner_id": null,
  "caller_workflow": ".github/workflows/tlsn-release-eligibility.yml",
  "caller_revision_policy": "MAIN_HISTORY_AND_LIVE_RUN_WORKFLOW_SHA",
  "delegate_workflow": ".github/workflows/tlsn-grant-delegation.yml",
  "delegate_revision": null,
  "delegate_claims_contract": "SIGNED_JOB_WORKFLOW_REF_AND_SHA_REQUIRED_NO_FALLBACK",
  "event": "workflow_run",
  "ref": "refs/heads/main",
  "eligibility_contract": "evaluateReleaseRun:production-only:v1",
  "workflow_source_rule": "LIVE_TAG_SOURCE_DISTINCT_FROM_CALLER_AND_DELEGATE_SHA",
  "authority_endpoint": null,
  "authority_deployment_identity": null,
  "authority_state_epoch": null,
  "policy_pin_source_contract": "INDEPENDENT_AUTHORITY_AND_CONSUMER_BOOTSTRAP_NOT_CANDIDATE",
  "policy_digest_contract": null,
  "active_policy_registry_identity": null,
  "public_input_derivation_contract": null,
  "capture_selection_contract": null,
  "capture_state_contract": "EXACT_CONSUMED_AUTHORITY_RESULT_RECEIPT_BINDING_CATALOG",
  "grant_issuer_identity": null,
  "grant_scope_contract": null,
  "grant_wire_contract": null,
  "grant_ttl_ms": null,
  "freshness_and_clock_contract": null,
  "revocation_contract": null,
  "state_revision_cas_contract": null,
  "external_io_contract": "IO_OUTSIDE_TRANSACTION_REVALIDATE_POLICY_CATALOG_EPOCH_BEFORE_CAS",
  "idempotence_contract": "SAME_SCOPE_SAME_BYTES_SAME_ID_EXPIRY_NO_RENEWAL_CONFLICT_ON_CHANGE",
  "consumer_read_endpoint": null,
  "consumer_identity_contract": null,
  "consumer_recheck_contract": "INDEPENDENT_EXPECTATIONS_LIVE_GRANT_STATE_EXACT_ARCHIVE_BYTES_NATIVE_SEPARATE",
  "source_inventory_contract": null
}
